{
  "schema": "care-event",
  "event_id": "evt_possible_floor_stay_demo",
  "event_type": "possible_floor_stay",
  "occurred_at": "2026-05-18T15:00:00Z",
  "camera_id": "living_room",
  "zone_id": "floor_zone",
  "severity": "high",
  "confidence": "high",
  "status": "awaiting_human_confirmation",
  "requires_human_confirmation": true,
  "allowed_actions": ["journal_entry", "caregiver_alert", "facetime_handoff"],
  "blocked_actions": ["autonomous_emergency_dispatch", "medical_diagnosis"],
  "evidence": {
    "raw_video_stays_local": true,
    "dwell_seconds": 31,
    "model": "yolo26n-mlx"
  }
}
